{
  "$schema": "http://json-schema.org/draft-07/schema#",
  "type": "object",
  "required": ["type", "name", "steps"],
  "properties": {
    "type": {"const": "workflow"},
    "code": {"type": "string"},
    "name": {"type": "string"},
    "description": {"type": "string"},
    "version": {"type": "string"},
    "steps": {
      "type": "array",
      "items": {
        "type": "object",
        "required": ["step_id", "name", "type"],
        "properties": {
          "step_id": {"type": "string"},
          "name": {"type": "string"},
          "description": {"type": "string"},
          "optional": {"type": "boolean"},
          "type": {"type": "string"},
          "level": {"type": "integer"},
          "inputs": {"type": "array"},
          "outputs": {"type": "array"},
          "next_steps": {"type": "array", "items": {"type": "string"}}
        },
        "additionalProperties": true
      }
    }
  },
  "additionalProperties": true
}
