{
  "code": "transition_to_euro",
  "type": "workflow",
  "name": "Transition to Euro",
  "description": "Step-by-step workflow to help companies migrate accounting and reporting from PLN to EUR.",
  "version": "1.0",
  "steps": [
    {
      "step_id": "analysis_current_structures",
      "name": "Analyze Current Structures",
      "description": "Analyze existing accounts, currencies, and data sources.",
      "optional": false,
      "type": "manual",
      "outputs": ["current_account_map.json"],
      "next_steps": ["create_euro_chart_accounts"]
    },
    {
      "step_id": "create_euro_chart_accounts",
      "name": "Create Euro Chart of Accounts",
      "description": "Generate mirror accounts in EUR based on existing PLN accounts.",
      "optional": false,
      "type": "automated",
      "inputs": ["current_account_map.json"],
      "outputs": ["euro_account_map.json"],
      "next_steps": ["set_transition_date"]
    },
    {
      "step_id": "set_transition_date",
      "name": "Set Transition Date",
      "description": "Define the effective date from which EUR accounts become active.",
      "optional": false,
      "type": "manual",
      "outputs": ["transition_date.txt"],
      "next_steps": ["perform_currency_conversion"]
    },
    {
      "step_id": "perform_currency_conversion",
      "name": "Perform Currency Conversion",
      "description": "Transfer PLN account balances to EUR accounts based on official exchange rates (NBP/ECB).",
      "optional": false,
      "type": "automated",
      "inputs": ["euro_account_map.json", "transition_date.txt"],
      "outputs": ["conversion_journal_entries.json"],
      "next_steps": ["migrate_integrations"]
    },
    {
      "step_id": "migrate_integrations",
      "name": "Migrate ERP and Document Workflow Integrations",
      "description": "Update account aliases and mappings in connected ERP or document management systems if necessary.",
      "optional": true,
      "type": "automated",
      "inputs": ["conversion_journal_entries.json"],
      "outputs": ["integration_migration_report.json"],
      "next_steps": ["update_reporting_templates"]
    },
    {
      "step_id": "update_reporting_templates",
      "name": "Update Reporting Templates",
      "description": "Adjust financial reports (balance sheet, P&L, cash flow) to EUR currency from the transition date.",
      "optional": false,
      "type": "automated",
      "inputs": ["integration_migration_report.json", "transition_date.txt"],
      "outputs": ["updated_reports_templates.json"],
      "next_steps": ["update_pricing_and_contracts"]
    },
    {
      "step_id": "update_pricing_and_contracts",
      "name": "Update Pricing and Contracts",
      "description": "Revise pricing lists and contract currency denominations where applicable.",
      "optional": true,
      "type": "manual",
      "outputs": ["updated_contracts_summary.txt"],
      "next_steps": ["submit_audit_documents"]
    },
    {
      "step_id": "submit_audit_documents",
      "name": "Submit Documents for Audit",
      "description": "Provide updated accounting plans and reports to auditors for compliance confirmation.",
      "optional": true,
      "type": "manual",
      "outputs": ["audit_submission_receipt.txt"],
      "next_steps": ["go_live"]
    },
    {
      "step_id": "go_live",
      "name": "Go Live with Euro",
      "description": "Begin recording all new transactions in EUR from the transition date onward.",
      "optional": false,
      "type": "automated",
      "inputs": ["transition_date.txt"],
      "outputs": ["euro_operations_log.json"],
      "next_steps": []
    }
  ]
}
